{
  "version": 1,
  "name": "test_in_correction",
  "preamp_db": -12.0,
  "bands": [
    {
      "hz": 31.0,
      "gain_db": 12.0
    },
    {
      "hz": 62.0,
      "gain_db": 12.0
    },
    {
      "hz": 125.0,
      "gain_db": 12.0
    },
    {
      "hz": 250.0,
      "gain_db": 12.0
    },
    {
      "hz": 500.0,
      "gain_db": 12.0
    },
    {
      "hz": 1000.0,
      "gain_db": 12.0
    },
    {
      "hz": 2000.0,
      "gain_db": 12.0
    },
    {
      "hz": 4000.0,
      "gain_db": 12.0
    },
    {
      "hz": 8000.0,
      "gain_db": 12.0
    },
    {
      "hz": 16000.0,
      "gain_db": 12.0
    }
  ]
}
